<?xml version="1.0" encoding="utf-8"?>
<PackageDefinition xsi:schemaLocation="http://www.buildamation.com ./Schema/BamPackageDefinitionV1.xsd" xmlns:xsi="http://www.w3.org/2001/XMLSchema-instance" xmlns="http://www.buildamation.com">
  <RequiredPackages>
    <Package Name="C">
      <Version Id="dev" />
    </Package>
    <Package Name="Clang">
      <Version Id="Apple425" Default="true" />
      <Version Id="Apple503" />
      <Version Id="Apple600" />
    </Package>
    <Package Name="Gcc">
      <Version Id="4.1" Condition="'$(Platform)' == 'Windows' || '$(Platform)' == 'Unix'" />
      <Version Id="4.4" Condition="'$(Platform)' == 'Windows' || '$(Platform)' == 'Unix'" />
      <Version Id="4.5" Condition="'$(Platform)' == 'Windows' || '$(Platform)' == 'Unix'" />
      <Version Id="4.6" Condition="'$(Platform)' == 'Windows' || '$(Platform)' == 'Unix'" />
      <Version Id="4.8" Condition="'$(Platform)' == 'Windows' || '$(Platform)' == 'Unix'" Default="true" />
    </Package>
    <Package Name="LLVMGcc">
      <Version Id="4.2" Default="true" />
    </Package>
    <Package Name="MakeFileBuilder">
      <Version Id="dev" />
    </Package>
    <Package Name="NativeBuilder">
      <Version Id="dev" />
    </Package>
    <Package Name="XcodeBuilder">
      <Version Id="dev" />
    </Package>
  </RequiredPackages>
  <RequiredBamAssemblies>
    <BamAssembly Name="Bam.Core" />
  </RequiredBamAssemblies>
  <RequiredDotNetAssemblies>
    <DotNetAssembly Name="System" RequiredTargetFramework="2.0.50727" />
    <DotNetAssembly Name="System.Xml" RequiredTargetFramework="2.0.50727" />
  </RequiredDotNetAssemblies>
  <SupportedPlatforms>
    <Platform Name="Windows" />
    <Platform Name="Unix" />
    <Platform Name="OSX" />
  </SupportedPlatforms>
</PackageDefinition>
