<?xml version="1.0" encoding="utf-8"?>
<PackageDefinition xsi:schemaLocation="http://www.buildamation.com ./Schema/BamPackageDefinitionV1.xsd" xmlns:xsi="http://www.w3.org/2001/XMLSchema-instance" xmlns="http://www.buildamation.com">
  <RequiredPackages>
    <Package Name="C">
      <Version Id="dev" />
    </Package>
    <Package Name="Clang">
      <Version Id="3.1" />
    </Package>
    <Package Name="GLEW">
      <Version Id="1.5.7" />
    </Package>
    <Package Name="LLVMGcc">
      <Version Id="4.2" />
    </Package>
    <Package Name="MakeFileBuilder">
      <Version Id="dev" />
    </Package>
    <Package Name="Mingw">
      <Version Id="3.4.5" />
      <Version Id="4.5.0" />
      <Version Id="4.8.1" Default="true" />
    </Package>
    <Package Name="NativeBuilder">
      <Version Id="dev" />
    </Package>
    <Package Name="OpenGLSDK">
      <Version Id="dev" />
    </Package>
    <Package Name="VisualC">
      <Version Id="10.0" />
      <Version Id="11.0" />
      <Version Id="12.0" Default="true" />
      <Version Id="8.0" />
      <Version Id="9.0" />
    </Package>
    <Package Name="VSSolutionBuilder">
      <Version Id="dev" />
    </Package>
    <Package Name="WindowsSDK">
      <Version Id="6.0A" Default="true" />
      <Version Id="7.1" />
      <Version Id="8.1" />
    </Package>
    <Package Name="XcodeBuilder">
      <Version Id="dev" />
    </Package>
  </RequiredPackages>
  <RequiredBamAssemblies>
    <BamAssembly Name="Bam.Core" />
  </RequiredBamAssemblies>
  <RequiredDotNetAssemblies>
    <DotNetAssembly Name="System" RequiredTargetFramework="4.0.30319" />
    <DotNetAssembly Name="System.Xml" RequiredTargetFramework="4.0.30319" />
    <DotNetAssembly Name="System.Core" RequiredTargetFramework="4.0.30319" />
  </RequiredDotNetAssemblies>
  <SupportedPlatforms>
    <Platform Name="Windows" />
  </SupportedPlatforms>
</PackageDefinition>
