<?xml version="1.0" encoding="utf-8"?>
<PackageDefinition xsi:schemaLocation="http://www.buildamation.com ./Schema/BamPackageDefinitionV1.xsd" xmlns:xsi="http://www.w3.org/2001/XMLSchema-instance" xmlns="http://www.buildamation.com">
  <RequiredPackages>
    <Package Name="DotNetFramework">
      <Version Id="2.0.50727" />
      <Version Id="3.5" Default="true" />
      <Version Id="4.0" />
    </Package>
    <Package Name="MakeFileBuilder">
      <Version Id="dev" />
    </Package>
    <Package Name="NativeBuilder">
      <Version Id="dev" />
    </Package>
    <Package Name="Publisher">
      <Version Id="dev" />
    </Package>
    <Package Name="VSSolutionBuilder">
      <Version Id="dev" />
    </Package>
  </RequiredPackages>
  <RequiredBamAssemblies>
    <BamAssembly Name="Bam.Core" />
  </RequiredBamAssemblies>
  <RequiredDotNetAssemblies>
    <DotNetAssembly Name="System" RequiredTargetFramework="2.0.50727" />
    <DotNetAssembly Name="System.Xml" RequiredTargetFramework="2.0.50727" />
  </RequiredDotNetAssemblies>
  <SupportedPlatforms>
    <Platform Name="Windows" />
    <Platform Name="Unix" />
    <Platform Name="OSX" />
  </SupportedPlatforms>
</PackageDefinition>
