<?xml version="1.0" encoding="utf-8"?>
<PackageDefinition xsi:schemaLocation="http://www.buildamation.com ./Schema/BamPackageDefinitionV1.xsd" xmlns:xsi="http://www.w3.org/2001/XMLSchema-instance" xmlns="http://www.buildamation.com">
  <RequiredPackages>
    <Package Name="MakeFileBuilder">
      <Version Id="dev" />
    </Package>
    <Package Name="Publisher">
      <Version Id="dev" />
    </Package>
    <Package Name="QMakeBuilder">
      <Version Id="dev" />
    </Package>
    <Package Name="VisualC">
      <Version Id="10.0" />
      <Version Id="11.0" />
      <Version Id="12.0" Default="true" />
      <Version Id="8.0" />
      <Version Id="9.0" />
    </Package>
    <Package Name="VSSolutionBuilder">
      <Version Id="dev" />
    </Package>
    <Package Name="XcodeBuilder">
      <Version Id="dev" />
    </Package>
    <Package Name="zeromq">
      <Version Id="3.2.3" />
    </Package>
  </RequiredPackages>
  <RequiredBamAssemblies>
    <BamAssembly Name="Bam.Core" />
  </RequiredBamAssemblies>
  <RequiredDotNetAssemblies>
    <DotNetAssembly Name="System" RequiredTargetFramework="2.0.50727" />
    <DotNetAssembly Name="System.Xml" RequiredTargetFramework="2.0.50727" />
  </RequiredDotNetAssemblies>
  <SupportedPlatforms>
    <Platform Name="Windows" />
    <Platform Name="Unix" />
    <Platform Name="OSX" />
  </SupportedPlatforms>
</PackageDefinition>
